{
  "$schema": "http://json-schema.org/schema#",
  "$schemaVersion": "1.3.0",
  "$id": "https://smart-data-models.github.io/dataModel.DigitalMarketing/DataProvider/schema.json",
  "title": "Smart Data Models - DataProvider",
  "description": "A technical agent (ETL, connector, ingestion service) that injects DigitalAssetMetric observations into the data space. Decoupled from Organization so that the same metric for the same channel on the same day can be supplied by multiple providers (e.g. an internal pipeline and a third-party agency) and remain distinguishable in the historic.",
  "modelTags": "DigitalMarketing",
  "type": "object",
  "properties": {
    "id": {
      "anyOf": [
        {
          "type": "string",
          "minLength": 1,
          "maxLength": 256,
          "pattern": "^[\\w\\-\\.\\{\\}\\$\\+\\*\\[\\]`|~^@!,:\\\\]+$"
        },
        {
          "type": "string",
          "format": "uri"
        }
      ],
      "description": "Unique identifier of the entity. Recommended pattern: urn:ngsi-ld:DataProvider:<short-name>."
    },
    "type": {
      "type": "string",
      "enum": [
        "DataProvider"
      ],
      "description": "Property. NGSI Entity type. It has to be DataProvider."
    },
    "name": {
      "type": "string",
      "description": "Property. Human-readable name of the provider (e.g. 'LIN3S Ariadne ETL', 'Acme Internal Pipeline')."
    },
    "alternateName": {
      "type": "string",
      "description": "Property. Alternative or short name."
    },
    "description": {
      "type": "string",
      "description": "Property. Free-text description of what this provider does and how it processes data."
    },
    "providerKind": {
      "type": "string",
      "enum": [
        "Internal",
        "External",
        "Agency",
        "Self",
        "Other"
      ],
      "description": "Property. Optional classification of the provider's relationship with the brand owner. 'Internal' = pipeline operated by the same Organization that owns the Brand. 'External' = an independent third party. 'Agency' = a marketing agency operating on behalf of the brand. 'Self' = the SaaS itself (e.g. Google sending raw data)."
    },
    "version": {
      "type": "string",
      "description": "Property. Version or release identifier of the provider's pipeline/connector. Useful for reproducibility when two versions of the same provider co-exist."
    },
    "url": {
      "type": "string",
      "format": "uri",
      "description": "Property. URL of the provider's service or documentation."
    },
    "refOrganization": {
      "anyOf": [
        {
          "type": "string",
          "minLength": 1,
          "maxLength": 256,
          "pattern": "^[\\w\\-\\.\\{\\}\\$\\+\\*\\[\\]`|~^@!,:\\\\]+$"
        },
        {
          "type": "string",
          "format": "uri"
        }
      ],
      "description": "Relationship. URN of the Organization that LEGALLY OWNS the data emitted by this provider. In a sovereign data space this is typically the same Organization that owns the Brand (canonical Internal case)."
    },
    "refOperator": {
      "anyOf": [
        {
          "type": "string",
          "minLength": 1,
          "maxLength": 256,
          "pattern": "^[\\w\\-\\.\\{\\}\\$\\+\\*\\[\\]`|~^@!,:\\\\]+$"
        },
        {
          "type": "string",
          "format": "uri"
        }
      ],
      "description": "Relationship. URN of the Organization that TECHNICALLY OPERATES the pipeline (executes the ETL, owns the credentials, runs the connector). Optional: omit when operator equals owner (refOrganization). Use it to make explicit a delegation, e.g. an integrator running the pipeline on behalf of the data owner."
    }
  },
  "required": [
    "id",
    "type",
    "name",
    "refOrganization"
  ],
  "derivedFrom": "",
  "license": "https://github.com/smart-data-models/dataModel.DigitalMarketing/blob/master/LICENSE.md"
}