{
  "id": "urn:ngsi-ld:DataProvider:Acme-Internal-Pipeline",
  "type": "DataProvider",
  "name": "Acme Internal Marketing Pipeline",
  "alternateName": "Acme ETL",
  "description": "Internal data ingestion pipeline of Acme that pulls daily metrics from the brand's own digital channels (GA4, LinkedIn, ...) and emits them as DigitalAssetMetric observations into the data space. Today operated by LIN3S under a delegated-operation contract; the data remains Acme's.",
  "providerKind": "Internal",
  "version": "1.4.0",
  "refOrganization": "urn:ngsi-ld:Organization:ES-B12345678",
  "refOperator": "urn:ngsi-ld:Organization:LIN3S"
}
